{
  "spec_version": "0.1",
  "agent": {
    "name": "codex",
    "version": "2026.9.1"
  },
  "operator": {
    "id": "github:alice"
  },
  "session": {
    "id": "sess_7f3a9c",
    "started_at": "2026-09-18T09:12:00Z"
  },
  "change": {
    "base_commit": "5d41402abc4b2a76b9719d911017c592e2c1a5f0",
    "head_commit": "7c4a8d09ca3762af61e59520943dc26494f8941b"
  }
}
